{
  "schemaVersion": "1",
  "inputVarDefinitions": [
    {
      "key": "REPO_URL",
      "description": "Git remote URL to analyze",
      "suggestedDefault": ""
    },
    {
      "key": "FOCUS_AREA",
      "description": "Optional area to emphasize (e.g. auth, build, APIs)",
      "suggestedDefault": ""
    }
  ],
  "iteratorFields": [],
  "steps": [
    { "key": "analyze", "name": "Analyze repository" },
    { "key": "summarize", "name": "Write overview" }
  ]
}
